{
  "$schema": "wheel-profile.schema.json",
  "schemaVersion": 2,
  "id": "PSWBENT",
  "name": "Fanatec Podium Steering Wheel Bentley GT3",
  "shortName": "Fanatec Podium Bentley GT3",
  "match": {
    "wheelType": "PSWBENT"
  },
  "display": "itm",
  "itmDeviceId": 4,
  "verified": false,
  "leds": [
    { "channel": "revRgb",  "hwIndex": 0, "role": "rev",  "label": "Rev LED 1" },
    { "channel": "revRgb",  "hwIndex": 1, "role": "rev",  "label": "Rev LED 2" },
    { "channel": "revRgb",  "hwIndex": 2, "role": "rev",  "label": "Rev LED 3" },
    { "channel": "revRgb",  "hwIndex": 3, "role": "rev",  "label": "Rev LED 4" },
    { "channel": "revRgb",  "hwIndex": 4, "role": "rev",  "label": "Rev LED 5" },
    { "channel": "revRgb",  "hwIndex": 5, "role": "rev",  "label": "Rev LED 6" },
    { "channel": "revRgb",  "hwIndex": 6, "role": "rev",  "label": "Rev LED 7" },
    { "channel": "revRgb",  "hwIndex": 7, "role": "rev",  "label": "Rev LED 8" },
    { "channel": "revRgb",  "hwIndex": 8, "role": "rev",  "label": "Rev LED 9" },
    { "channel": "flagRgb", "hwIndex": 0, "role": "flag", "label": "Flag LED 1" },
    { "channel": "flagRgb", "hwIndex": 1, "role": "flag", "label": "Flag LED 2" },
    { "channel": "flagRgb", "hwIndex": 2, "role": "flag", "label": "Flag LED 3" },
    { "channel": "flagRgb", "hwIndex": 3, "role": "flag", "label": "Flag LED 4" },
    { "channel": "flagRgb", "hwIndex": 4, "role": "flag", "label": "Flag LED 5" },
    { "channel": "flagRgb", "hwIndex": 5, "role": "flag", "label": "Flag LED 6" }
  ]
}
